{
  "id": "canon_edit.canon.sample.priority.edit.supersede",
  "state_root": "examples/state-root",
  "detected_at": "2026-07-30T00:00:00Z",
  "change_type": "edit",
  "target_claim_id": "canon.sample.priority",
  "before": {
    "id": "canon.sample.priority",
    "entity_ref": "sampleco",
    "claim_type": "priority",
    "statement": "SampleCo should validate one narrow workflow before broadening scope.",
    "artifact_ref": null,
    "evidence_refs": ["memory:canonical-priority-note"],
    "status": "active",
    "supersedes": null,
    "superseded_by": null,
    "determined_at": "2026-07-01T00:00:00Z",
    "validity": {
      "window_days": 30,
      "basis": "calendar",
      "last_confirmed_at": "2026-07-01T00:00:00Z"
    },
    "generated_at": "2026-07-01T00:05:00Z",
    "generated_by": "example"
  },
  "after": {
    "id": "canon.sample.priority",
    "entity_ref": "sampleco",
    "claim_type": "priority",
    "statement": "SampleCo should prioritize onboarding pilots.",
    "artifact_ref": null,
    "evidence_refs": ["memory:canonical-priority-note"],
    "status": "active",
    "supersedes": null,
    "superseded_by": null,
    "determined_at": "2026-07-30T00:00:00Z",
    "validity": {
      "window_days": 30,
      "basis": "calendar",
      "last_confirmed_at": "2026-07-30T00:00:00Z"
    },
    "generated_at": "2026-07-30T00:05:00Z",
    "generated_by": "human-edit"
  },
  "status": "unreconciled",
  "requires_human_review": false,
  "review_reason": null,
  "reconciliation": null,
  "reconciled_at": null
}
